<?xml version="1.0" encoding="UTF-8"?>
<!-- edited with XMLSPY v2004 rel. 3 U (http://www.xmlspy.com) by kossi (NONE) -->
<?xml-stylesheet type="text/xsl" href="D:\Studium\XML-Technologien\XMLTECH\Uebung03\Uebung03.xslt"?>
<workgroup xmlns="http://www.my-webbase.de/xml" xmlns:xsi="http://www.w3.org/2001/XMLSchema-instance" xsi:schemaLocation="http://www.my-webbase.de/xml
Uebung03.xsd" name="Netzbasierte Informationssysteme / Networked Informationsystems">
	<news>
		<notice type="Projektstart" keyref="project_06">
			<date>2004-02-08</date>
		</notice>
		<notice type="Projektstart" keyref="project_03">
			<date>2004-01-01</date>
		</notice>
		<notice type="Projektstart" keyref="project_11">
			<date>2004-01-01</date>
		</notice>
		<notice type="Projektstart" keyref="project_01">
			<date>2003-09-01</date>
		</notice>
		<notice type="Projektstart" keyref="project_02">
			<date>2003-07-01</date>
		</notice>
		<notice type="Update" keyref="advice_01">
			<date>2003-03-11</date>
		</notice>
	</news>
	<teaching>
		<courses>
			<term season="SS" year="2004"/>
			<course courseType="lecture" href="http://www.inf.fu-berlin.de/inst/ag-nbi/lehre/04/V_ALPIV/">Algorithmen und Programmierung IV	</course>
			<course courseType="lecture" href="http://www.inf.fu-berlin.de/inst/ag-nbi/lehre/04/V_XML/">XML Technologien</course>
			<course courseType="seminar" href="http://www.inf.fu-berlin.de/inst/ag-nbi/lehre/04/S_P2PNET/index.html">Peer-to-Peer-Netzwerke</course>
			<course courseType="practical" href="http://www.inf.fu-berlin.de/inst/ag-nbi/lehre/04/P_SW">Semantic Web</course>
		</courses>
		<courses>
			<term season="WS" year="2003"/>
			<href>http://www.inf.fu-berlin.de/inst/ag-nbi/lehre/AlteLehre.html</href>
		</courses>
		<assignments href="http://www.inf.fu-berlin.de/inst/ag-nbi/lehre/diploma.html">
			<description>Fortlaufend werden Diplom- und andere Arbeiten betreut. Sie können sich anhand der Liste macher Diplomarbeitsthemen orientieren.</description>
			<advices>
				<advice href="http://www.inf.fu-berlin.de/inst/ag-nbi/lehre/tipps/referatepapiere.pdf" id="advice_03">Referaten und Ausarbeitungen</advice>
				<advice href="http://www.inf.fu-berlin.de/inst/ag-nbi/lehre/tipps/diplomarbeiten.pdf" id="advice_02">Diplomarbeiten</advice>
				<advice href="http://www.inf.fu-berlin.de/inst/ag-nbi/lehre/seminare.html" id="advice_01">Ablauf und Leistungserbringung in Seminaren</advice>
			</advices>
		</assignments>
	</teaching>
	<research>
		<projects topic="Semantic Web">
			<project id="project_01">
				<name>Semantic Web in der Pathologie</name>
				<brief-description>An information retrieval system for images and text based on Semantic Web technologies for pathology focusing on lungdiseases.</brief-description>
				<description>
					<english-version>http://www.inf.fu-berlin.de/inst/ag-nbi/research/swpatho/swpathoEng.html</english-version>
					<abstract>Entwicklung, Implementierung und Evaluierung eines auf Semantic Web Technologien basierenden Bild- und Informationsretrievalsystems für die Digitale Pathologie am Beispiel von Lungenkrankheiten. Das Projekt entwickelt ein prototypisches System für Verarbeitung und Retrieval von Bildbeschreibungen und Befundberichten in der Pathologie, speziell für Lungenerkrankungen. Im Gegensatz zu heutigen Datenbanken soll die Information durchgehend semantisch annotiert und mit Ontologien verknüpft sein, was eine Recherche nach Inhalten gestattet. Das in den Bild- und Textdaten enthaltene Expertenwissen lässt sich damit anderen Anwendungsszenarien zugänglich und wiederverwendbar machen. Es kann zur Qualitätssicherung, zur Unterstützung von Diagnostik und Differentialdiagnose, zur statistischen Auswertung, zu Präsentationen und in der Lehre genutzt werden.
Bei der Erstellung von Befundberichten wird semantische Information durch computerlinguistische Analyse automatisch erfasst und in ein semantisches Netz eingefügt, das auf einem Pathologiespezifischen Modell basiert. Das System stellt diese Information dann für die unterschiedlichen Zwecke zur Verfügung. Eine Integrationskomponente versucht darüber hinaus, Informationen aus externen Wissensquellen einzubinden. Technologisch basiert das geplante System auf den Standards des Semantic Web wie XML, RDF und RuleML und anerkannten medizinischen Modellen und Standards (UMLS, HL7, SCORM).
					</abstract>
					<initiators>
						<person xsi:type="Initiator">
							<ID>initiator_01</ID>
							<name>
								<title>Dr. med.</title>
								<title>Dipl.med.Inf.(FH)</title>
								<first>Thomas</first>
								<last>Schrader</last>
							</name>
							<address>
								<name>Uni-Klinik Charité Institut für Pathologie</name>
								<street>Schumanstr. 20-21</street>
								<zipcode>10117</zipcode>
								<city>Berlin</city>
								<country>Deutschland</country>
							</address>
							<phone>030450536113</phone>
							<email>thomas.schrader@charite.de</email>
							<role>UICC-TPCC Administrator, Pathologe</role>
						</person>
						<person xsi:type="Initiator">
							<ID>initiator_02</ID>
							<name>
								<title>Prof.</title>
								<title>Dr.</title>
								<first>Manfred</first>
								<last>Strede</last>
							</name>
							<address>
								<name>Universität Potsdam Institut für Linguistik</name>
								<street>Postf. 601553</street>
								<zipcode>14415</zipcode>
								<city>Potsdam</city>
								<country>Deutschland</country>
							</address>
							<phone>03319772691</phone>
							<email>thomas.schrader@charite.de</email>
							<role>Professor für Angewandte Computerlinguistik</role>
						</person>
						<personREF>member_01</personREF>
					</initiators>
					<contacts>
						<REF>member_05</REF>
					</contacts>
					<workpackages>
						<package id="AP1" href="http://www.inf.fu-berlin.de/inst/ag-nbi/research/swpatho/ap1_150304.pdf">Entwurf und Entwicklung einer Beschreibungskomponente zur Erfassung und Repräsentation von Text- und Bildinformationen</package>
						<package id="AP2">Entwurf, Implementierung und Evaluation der Fachwissenskomponente</package>
						<package id="AP3">Entwurf und Implementierung einer Transformationskomponente zur Analyse und semantischen Repräsentation bestehender Befundberichte</package>
						<package id="AP4">Entwurf, Implementierung und Evaluation von Anwendungskomponenten</package>
						<package id="AP5">Entwurf und Implementierung von Integrationskomponenten</package>
						<package id="AP6">Systemvalidierung in der Anwendung</package>
						<package id="AP7">Projekt-, Qualitätsmanagement und Aussendarstellung</package>
					</workpackages>
					<publications>
						<publication href="http://www.inf.fu-berlin.de/inst/ag-nbi/research/swpatho/icwe04.pdf">
							<title>Engineering a Semantic Web for Pathology (ICWE'04 Conference)</title>
							<authors>
								<personREF>member_01</personREF>
								<personREF>member_05</personREF>
							</authors>
						</publication>
						<publication href="http://www.inf.fu-berlin.de/inst/ag-nbi/research/swpatho/TagungDeutscheGesellschaftPathologieRostock.doc">
							<title>Tagung Deutsche Gesellschaft für Pathologie Rostock 2004</title>
							<authors>
								<personREF>member_01</personREF>
							</authors>
						</publication>
					</publications>
				</description>
				<partner>Humboldt-Universität zu Berlin</partner>
				<partner>Universität Potsdam</partner>
			</project>
			<project id="project_02">
				<name>Wissensnetze</name>
				<brief-description>Studies  the impact of semantic technologies from the business and the technical viewpoint to make predictions about the influence of the new technologies on markets, enterprises and individuals.</brief-description>
				<description>
					<href>http://www.inf.fu-berlin.de/inst/ag-nbi/research/wissensnetze</href>
				</description>
				<sponsor>Berlin Research Centre for the Internet Economy InterVal</sponsor>
			</project>
			<project id="project_03">
				<name>KnowledgeWeb</name>
				<brief-description>Network of Excellence. Realizing the Semantic Web</brief-description>
				<description>
					<href>http://knowledgeweb.semanticweb.org</href>
				</description>
				<sponsor>EU FP6</sponsor>
			</project>
			<project id="project_04">
				<name>OntoWeb</name>
				<brief-description>Ontology-based information exchange for knowledge management and electronic commerce.</brief-description>
				<description>
					<href>http://www.ontoweb.org</href>
				</description>
				<sponsor>European Union</sponsor>
			</project>
			<project id="project_05">
				<name>Agentlink III</name>
				<brief-description>Network of Excellence in Agent research.</brief-description>
				<description>
					<href>http://www.agentlink.org</href>
				</description>
				<sponsor>European Union</sponsor>
			</project>
		</projects>
		<projects topic="XML Technologies">
			<project id="project_06">
				<name>XML Sicherheitsdienste fuer GBIF-D</name>
				<brief-description>Providing XML security services and access controls for the German node of the Global Biodiversity Information Facility.</brief-description>
				<description>
					<href>http://www.inf.fu-berlin.de/inst/ag-nbi/research/IBIS-D</href>
				</description>
				<partner href="http://www.bgbm.org/">Botanischer Garten und Botanisches Museum Berlin</partner>
				<partner href="http://www.gbif.de/">German node of the Global Biodiversity Information Facility</partner>
				<sponsor>BMBF</sponsor>
			</project>
			<project id="project_07">
				<name>SYNTHESYS</name>
				<brief-description>Develop authentication services for system access in DiGIR/ABCD, so that restricted data access can be granted to appropriate end-users.</brief-description>
				<description>
					<href>http://www.synthesys.info</href>
				</description>
				<partner href="http://www.bgbm.org/">Botanischer Garten und Botanisches Museum Berlin</partner>
				<sponsor>European Union</sponsor>
			</project>
			<project id="project_08">